<?xml version="1.0" encoding="UTF-8"?>
<tabel xmlns:xsi="http://www.w3.org/2001/XMLSchema-instance"
	   xsi:noNamespaceSchemaLocation="tabel_group.xsd">
	<clerk>
		<name>Vlad</name>
		<birthday>1989-09-21</birthday>
		<id>777</id>
	</clerk>
	<worker>
		<name>Petr</name>
		<birthday>1985-05-10</birthday>
		<snils>123456789</snils>
	</worker>
</tabel>